{
  "$schema": "../config/schema/harness.schema.json",
  "id": "claude-artifact",
  "label": "Claude Artifact page",
  "adapter": "claude-artifact.js",
  "handoff": "artifact",
  "references": "references/harness/claude-artifact.md",
  "artifactCapabilities": {"db": {}, "user": {}},
  "csp": {"scriptHosts": ["cdnjs.cloudflare.com", "cdn.jsdelivr.net/npm/", "unpkg.com"]},
  "notes": "Artifact pages only load scripts from the CDN allowlist, and jsDelivr only on its /npm/ path, so rendererUrl must point at a published npm version. Submit writes one document to the artifact's `batches` collection; each viewer's draft is kept privately under data/users/<id>/.",
  "config": {
    "delivery": {"mode": "url"},
    "output": {"inline": "artifact-page", "standalone": "artifact-page"},
    "placement": {"inlineLimits": {"table": false, "cards": false, "form": false, "flow": false, "kanban": false, "motion": false}},
    "copy": {
      "submit": {"save": "Submit to Claude", "saveForm": "Submit answers to Claude"},
      "feedbackSubmit": {"save": "Submit feedback"},
      "status": {"saved": "Submitted. Ask Claude to continue; it reads the saved batch."}
    }
  }
}
