{
  "$schema": "../config/schema/harness.schema.json",
  "id": "module",
  "label": "Data-only output for wrappers (MCP UI servers, custom hosts)",
  "adapter": null,
  "handoff": "module",
  "references": "references/harness/module.md",
  "notes": "Writes {spec, theme, config, renderer} JSON instead of HTML so a wrapper can build its own page around the same bundle and supply its own window.visualResponseHost.",
  "config": {"delivery": {"mode": "module"}}
}
